[12:49:54] [INFO] 
[12:49:54] [INFO] ================================================================================
[12:49:54] [INFO] STEP 2.1: Control Tests (COMPREHENSIVE) - STREAMING
[12:49:54] [INFO] ================================================================================
[12:49:54] [INFO] 
[12:49:54] [INFO] [SEQUENTIAL] Metrics processed sequentially (recommended for low I/O contention)
[12:49:54] [INFO] Processing: 3 filters × 4 modes × 3 metrics × 2 coherence types
[12:49:54] [INFO] 
################################################################################
[12:49:54] [INFO] # FILTER: ALL_STATIONS
[12:49:54] [INFO] ################################################################################
[12:49:54] [INFO] 
============================================================
[12:49:54] [INFO] MODE: PRECISE (GPS SPP with Precise Orbits)
[12:49:54] [INFO] ============================================================
[12:49:54] [INFO] Processing clock_bias...
[12:51:06] [INFO]   Fitting clock_bias/msc...
[12:51:06] [INFO]     global      : λ=1202km, R²=0.97
[12:51:06] [INFO]     europe      : λ=1000km, R²=0.94
[12:51:06] [INFO]     non_europe  : λ=1486km, R²=0.97
[12:51:06] [INFO]     northern    : λ=1109km, R²=0.98
[12:51:06] [INFO]     southern    : λ=1346km, R²=0.93
[12:51:06] [INFO]   Fitting clock_bias/phase_alignment...
[12:51:06] [INFO]     global      : λ=1703km, R²=0.70
[12:51:06] [INFO]     europe      : λ=12665km, R²=0.62
[12:51:06] [INFO]     non_europe  : λ=1699km, R²=0.77
[12:51:06] [INFO]     northern    : λ=1701km, R²=0.65
[12:51:06] [INFO]     southern    : λ=2007km, R²=0.75
[12:51:06] [INFO] Processing pos_jitter...
[12:52:17] [INFO]   Fitting pos_jitter/msc...
[12:52:17] [INFO]     global      : λ=1403km, R²=0.92
[12:52:17] [INFO]     europe      : λ=665km, R²=0.98
[12:52:17] [INFO]     non_europe  : λ=2170km, R²=0.96
[12:52:17] [INFO]     northern    : λ=1258km, R²=0.91
[12:52:17] [INFO]     southern    : λ=1208km, R²=0.94
[12:52:17] [INFO]   Fitting pos_jitter/phase_alignment...
[12:52:17] [INFO]     global      : λ=3581km, R²=0.96
[12:52:17] [INFO]     europe      : λ=3455km, R²=0.97
[12:52:17] [INFO]     non_europe  : λ=3440km, R²=0.97
[12:52:17] [INFO]     northern    : λ=2549km, R²=0.96
[12:52:17] [INFO]     southern    : λ=1716km, R²=0.93
[12:52:17] [INFO] Processing clock_drift...
[12:53:30] [INFO]   Fitting clock_drift/msc...
[12:53:30] [INFO]     global      : λ=1202km, R²=0.97
[12:53:30] [INFO]     europe      : λ=1029km, R²=0.93
[12:53:30] [INFO]     non_europe  : λ=1504km, R²=0.97
[12:53:30] [INFO]     northern    : λ=1111km, R²=0.98
[12:53:30] [INFO]     southern    : λ=1324km, R²=0.93
[12:53:30] [INFO]   Fitting clock_drift/phase_alignment...
[12:53:30] [INFO]     global      : λ=1166km, R²=0.85
[12:53:30] [INFO]     europe      : λ=1543km, R²=0.91
[12:53:30] [INFO]     non_europe  : λ=1194km, R²=0.91
[12:53:30] [INFO]     northern    : λ=1195km, R²=0.85
[12:53:30] [INFO]     southern    : λ=1301km, R²=0.79
[12:53:31] [INFO] 
------------------------------------------------------------
[12:53:31] [INFO] SUMMARY: PRECISE (GPS SPP with Precise Orbits)
[12:53:31] [INFO] ------------------------------------------------------------
[12:53:31] [INFO]   clock_bias/msc: global λ=1202km, R²=0.97; pairs_used=58,703,009; median(λ)=1202km, median(R²)=0.97; CV(λ)=0.14; regions_fit=5
[12:53:31] [INFO]   clock_bias/phase_alignment: global λ=1703km, R²=0.70; pairs_used=58,703,009; median(λ)=1703km, median(R²)=0.70; CV(λ)=1.10; regions_fit=5
[12:53:31] [INFO]   pos_jitter/msc: global λ=1403km, R²=0.92; pairs_used=58,703,009; median(λ)=1258km, median(R²)=0.94; CV(λ)=0.36; regions_fit=5
[12:53:31] [INFO]   pos_jitter/phase_alignment: global λ=3581km, R²=0.96; pairs_used=58,703,009; median(λ)=3440km, median(R²)=0.96; CV(λ)=0.24; regions_fit=5
[12:53:31] [INFO]   clock_drift/msc: global λ=1202km, R²=0.97; pairs_used=58,703,009; median(λ)=1202km, median(R²)=0.97; CV(λ)=0.14; regions_fit=5
[12:53:31] [INFO]   clock_drift/phase_alignment: global λ=1166km, R²=0.85; pairs_used=58,703,009; median(λ)=1195km, median(R²)=0.85; CV(λ)=0.11; regions_fit=5
[12:53:31] [INFO]   bias–drift (msc/global): λ_bias=1202km, λ_drift=1202km, Δλ=-0km, rel=0.00, R²_bias=0.97, R²_drift=0.97
[12:53:31] [INFO]   bias–drift (phase_alignment/global): λ_bias=1703km, λ_drift=1166km, Δλ=536km, rel=0.37, R²_bias=0.70, R²_drift=0.85 [WARNING: bias–drift mismatch]
[12:53:31] [INFO] 
============================================================
[12:53:31] [INFO] MODE: BASELINE (GPS L1 only)
[12:53:31] [INFO] ============================================================
[12:53:31] [INFO] Processing clock_bias...
[12:54:45] [INFO]   Fitting clock_bias/msc...
[12:54:45] [INFO]     global      : λ=727km, R²=0.95
[12:54:45] [INFO]     europe      : λ=561km, R²=0.90
[12:54:45] [INFO]     non_europe  : λ=854km, R²=0.96
[12:54:45] [INFO]     northern    : λ=691km, R²=0.96
[12:54:45] [INFO]     southern    : λ=1326km, R²=0.90
[12:54:45] [INFO]   Fitting clock_bias/phase_alignment...
[12:54:45] [INFO]     global      : λ=1796km, R²=0.91
[12:54:45] [INFO]     europe      : λ=10340km, R²=0.84
[12:54:45] [INFO]     non_europe  : λ=1640km, R²=0.91
[12:54:45] [INFO]     northern    : λ=1963km, R²=0.89
[12:54:45] [INFO]     southern    : λ=1686km, R²=0.88
[12:54:45] [INFO] Processing pos_jitter...
[12:55:59] [INFO]   Fitting pos_jitter/msc...
[12:55:59] [INFO]     global      : λ=878km, R²=0.98
[12:55:59] [INFO]     europe      : λ=566km, R²=1.00
[12:55:59] [INFO]     non_europe  : λ=1045km, R²=0.97
[12:55:59] [INFO]     northern    : λ=846km, R²=0.98
[12:55:59] [INFO]     southern    : λ=1125km, R²=0.96
[12:55:59] [INFO]   Fitting pos_jitter/phase_alignment...
[12:55:59] [INFO]     global      : λ=1991km, R²=0.97
[12:55:59] [INFO]     europe      : λ=5293km, R²=0.95
[12:55:59] [INFO]     non_europe  : λ=1958km, R²=0.96
[12:55:59] [INFO]     northern    : λ=2049km, R²=0.96
[12:55:59] [INFO]     southern    : λ=1708km, R²=0.97
[12:56:00] [INFO] Processing clock_drift...
[12:57:13] [INFO]   Fitting clock_drift/msc...
[12:57:13] [INFO]     global      : λ=702km, R²=0.96
[12:57:13] [INFO]     europe      : λ=561km, R²=0.90
[12:57:13] [INFO]     non_europe  : λ=838km, R²=0.96
[12:57:13] [INFO]     northern    : λ=670km, R²=0.97
[12:57:13] [INFO]     southern    : λ=1310km, R²=0.89
[12:57:13] [INFO]   Fitting clock_drift/phase_alignment...
[12:57:13] [INFO]     global      : λ=1019km, R²=0.95
[12:57:13] [INFO]     europe      : λ=1262km, R²=0.94
[12:57:13] [INFO]     non_europe  : λ=1044km, R²=0.96
[12:57:13] [INFO]     northern    : λ=1051km, R²=0.94
[12:57:13] [INFO]     southern    : λ=937km, R²=0.89
[12:57:13] [INFO] 
------------------------------------------------------------
[12:57:13] [INFO] SUMMARY: BASELINE (GPS L1 only)
[12:57:13] [INFO] ------------------------------------------------------------
[12:57:13] [INFO]   clock_bias/msc: global λ=727km, R²=0.95; pairs_used=61,853,126; median(λ)=727km, median(R²)=0.95; CV(λ)=0.32; regions_fit=5
[12:57:13] [INFO]   clock_bias/phase_alignment: global λ=1796km, R²=0.91; pairs_used=61,853,126; median(λ)=1796km, median(R²)=0.89; CV(λ)=0.98; regions_fit=5
[12:57:13] [INFO]   pos_jitter/msc: global λ=878km, R²=0.98; pairs_used=61,853,126; median(λ)=878km, median(R²)=0.98; CV(λ)=0.22; regions_fit=5
[12:57:13] [INFO]   pos_jitter/phase_alignment: global λ=1991km, R²=0.97; pairs_used=61,853,126; median(λ)=1991km, median(R²)=0.96; CV(λ)=0.52; regions_fit=5
[12:57:13] [INFO]   clock_drift/msc: global λ=702km, R²=0.96; pairs_used=61,853,126; median(λ)=702km, median(R²)=0.96; CV(λ)=0.32; regions_fit=5
[12:57:13] [INFO]   clock_drift/phase_alignment: global λ=1019km, R²=0.95; pairs_used=61,853,126; median(λ)=1044km, median(R²)=0.94; CV(λ)=0.10; regions_fit=5
[12:57:13] [INFO]   bias–drift (msc/global): λ_bias=727km, λ_drift=702km, Δλ=25km, rel=0.04, R²_bias=0.95, R²_drift=0.96
[12:57:13] [INFO]   bias–drift (phase_alignment/global): λ_bias=1796km, λ_drift=1019km, Δλ=777km, rel=0.55, R²_bias=0.91, R²_drift=0.95 [WARNING: bias–drift mismatch]
[12:57:13] [INFO] 
============================================================
[12:57:13] [INFO] MODE: IONOFREE (Dual-frequency L1+L2 ionosphere-free)
[12:57:13] [INFO] ============================================================
[12:57:13] [INFO] Processing clock_bias...
[12:58:27] [INFO]   Fitting clock_bias/msc...
[12:58:27] [INFO]     global      : λ=1073km, R²=0.97
[12:58:27] [INFO]     europe      : λ=868km, R²=0.94
[12:58:27] [INFO]     non_europe  : λ=1272km, R²=0.97
[12:58:27] [INFO]     northern    : λ=995km, R²=0.97
[12:58:27] [INFO]     southern    : λ=1268km, R²=0.94
[12:58:27] [INFO]   Fitting clock_bias/phase_alignment...
[12:58:27] [INFO]     global      : λ=1773km, R²=0.78
[12:58:27] [INFO]     europe      : λ=9786km, R²=0.74
[12:58:27] [INFO]     non_europe  : λ=1757km, R²=0.85
[12:58:27] [INFO]     northern    : λ=1763km, R²=0.73
[12:58:27] [INFO]     southern    : λ=2115km, R²=0.82
[12:58:27] [INFO] Processing pos_jitter...
[12:59:40] [INFO]   Fitting pos_jitter/msc...
[12:59:40] [INFO]     global      : λ=1239km, R²=0.94
[12:59:40] [INFO]     europe      : λ=595km, R²=0.99
[12:59:40] [INFO]     non_europe  : λ=1842km, R²=0.95
[12:59:40] [INFO]     northern    : λ=1122km, R²=0.94
[12:59:40] [INFO]     southern    : λ=1376km, R²=0.95
[12:59:40] [INFO]   Fitting pos_jitter/phase_alignment...
[12:59:40] [INFO]     global      : λ=3512km, R²=0.95
[12:59:40] [INFO]     europe      : λ=3365km, R²=0.97
[12:59:40] [INFO]     non_europe  : λ=3314km, R²=0.95
[12:59:40] [INFO]     northern    : λ=2832km, R²=0.93
[12:59:40] [INFO]     southern    : λ=2061km, R²=0.93
[12:59:41] [INFO] Processing clock_drift...
[13:00:54] [INFO]   Fitting clock_drift/msc...
[13:00:54] [INFO]     global      : λ=1074km, R²=0.97
[13:00:54] [INFO]     europe      : λ=867km, R²=0.94
[13:00:54] [INFO]     non_europe  : λ=1283km, R²=0.97
[13:00:54] [INFO]     northern    : λ=1000km, R²=0.97
[13:00:54] [INFO]     southern    : λ=1225km, R²=0.93
[13:00:54] [INFO]   Fitting clock_drift/phase_alignment...
[13:00:54] [INFO]     global      : λ=1103km, R²=0.89
[13:00:54] [INFO]     europe      : λ=1250km, R²=0.93
[13:00:54] [INFO]     non_europe  : λ=1158km, R²=0.94
[13:00:54] [INFO]     northern    : λ=1116km, R²=0.89
[13:00:54] [INFO]     southern    : λ=1226km, R²=0.85
[13:00:55] [INFO] 
------------------------------------------------------------
[13:00:55] [INFO] SUMMARY: IONOFREE (Dual-frequency L1+L2 ionosphere-free)
[13:00:55] [INFO] ------------------------------------------------------------
[13:00:55] [INFO]   clock_bias/msc: global λ=1073km, R²=0.97; pairs_used=59,141,613; median(λ)=1073km, median(R²)=0.97; CV(λ)=0.14; regions_fit=5
[13:00:55] [INFO]   clock_bias/phase_alignment: global λ=1773km, R²=0.78; pairs_used=59,141,613; median(λ)=1773km, median(R²)=0.78; CV(λ)=0.92; regions_fit=5
[13:00:55] [INFO]   pos_jitter/msc: global λ=1239km, R²=0.94; pairs_used=59,141,613; median(λ)=1239km, median(R²)=0.95; CV(λ)=0.33; regions_fit=5
[13:00:55] [INFO]   pos_jitter/phase_alignment: global λ=3512km, R²=0.95; pairs_used=59,141,613; median(λ)=3314km, median(R²)=0.95; CV(λ)=0.18; regions_fit=5
[13:00:55] [INFO]   clock_drift/msc: global λ=1074km, R²=0.97; pairs_used=59,141,613; median(λ)=1074km, median(R²)=0.97; CV(λ)=0.14; regions_fit=5
[13:00:55] [INFO]   clock_drift/phase_alignment: global λ=1103km, R²=0.89; pairs_used=59,141,613; median(λ)=1158km, median(R²)=0.89; CV(λ)=0.05; regions_fit=5
[13:00:55] [INFO]   bias–drift (msc/global): λ_bias=1073km, λ_drift=1074km, Δλ=-1km, rel=0.00, R²_bias=0.97, R²_drift=0.97
[13:00:55] [INFO]   bias–drift (phase_alignment/global): λ_bias=1773km, λ_drift=1103km, Δλ=670km, rel=0.47, R²_bias=0.78, R²_drift=0.89 [WARNING: bias–drift mismatch]
[13:00:55] [INFO] 
============================================================
[13:00:55] [INFO] MODE: MULTI_GNSS (GPS+GLO+GAL+BDS)
[13:00:55] [INFO] ============================================================
[13:00:55] [INFO] Processing clock_bias...
[13:02:05] [INFO]   Fitting clock_bias/msc...
[13:02:05] [INFO]     global      : λ=821km, R²=0.93
[13:02:05] [INFO]     europe      : λ=606km, R²=0.87
[13:02:05] [INFO]     non_europe  : λ=886km, R²=0.95
[13:02:05] [INFO]     northern    : λ=763km, R²=0.94
[13:02:05] [INFO]     southern    : λ=2157km, R²=0.90
[13:02:05] [INFO]   Fitting clock_bias/phase_alignment...
[13:02:05] [INFO]     global      : λ=1771km, R²=0.96
[13:02:05] [INFO]     europe      : λ=4261km, R²=0.82
[13:02:05] [INFO]     non_europe  : λ=1501km, R²=0.96
[13:02:05] [INFO]     northern    : λ=1911km, R²=0.94
[13:02:05] [INFO]     southern    : λ=1871km, R²=0.94
[13:02:05] [INFO] Processing pos_jitter...
[13:03:15] [INFO]   Fitting pos_jitter/msc...
[13:03:15] [INFO]     global      : λ=928km, R²=0.97
[13:03:15] [INFO]     europe      : λ=570km, R²=0.99
[13:03:15] [INFO]     non_europe  : λ=1025km, R²=0.96
[13:03:15] [INFO]     northern    : λ=874km, R²=0.98
[13:03:15] [INFO]     southern    : λ=1522km, R²=0.94
[13:03:15] [INFO]   Fitting pos_jitter/phase_alignment...
[13:03:15] [INFO]     global      : λ=1770km, R²=0.96
[13:03:15] [INFO]     europe      : λ=5159km, R²=0.96
[13:03:15] [INFO]     non_europe  : λ=1731km, R²=0.95
[13:03:15] [INFO]     northern    : λ=1828km, R²=0.95
[13:03:15] [INFO]     southern    : λ=1757km, R²=0.97
[13:03:15] [INFO] Processing clock_drift...
[13:04:23] [INFO]   Fitting clock_drift/msc...
[13:04:23] [INFO]     global      : λ=764km, R²=0.93
[13:04:23] [INFO]     europe      : λ=599km, R²=0.87
[13:04:23] [INFO]     non_europe  : λ=862km, R²=0.94
[13:04:23] [INFO]     northern    : λ=715km, R²=0.94
[13:04:23] [INFO]     southern    : λ=2191km, R²=0.90
[13:04:23] [INFO]   Fitting clock_drift/phase_alignment...
[13:04:23] [INFO]     global      : λ=984km, R²=0.97
[13:04:23] [INFO]     europe      : λ=1378km, R²=0.93
[13:04:23] [INFO]     non_europe  : λ=903km, R²=0.97
[13:04:23] [INFO]     northern    : λ=1009km, R²=0.97
[13:04:23] [INFO]     southern    : λ=1074km, R²=0.90
[13:04:23] [INFO] 
------------------------------------------------------------
[13:04:23] [INFO] SUMMARY: MULTI_GNSS (GPS+GLO+GAL+BDS)
[13:04:23] [INFO] ------------------------------------------------------------
[13:04:23] [INFO]   clock_bias/msc: global λ=821km, R²=0.93; pairs_used=58,050,018; median(λ)=821km, median(R²)=0.93; CV(λ)=0.54; regions_fit=5
[13:04:23] [INFO]   clock_bias/phase_alignment: global λ=1771km, R²=0.96; pairs_used=58,050,018; median(λ)=1871km, median(R²)=0.94; CV(λ)=0.45; regions_fit=5
[13:04:23] [INFO]   pos_jitter/msc: global λ=928km, R²=0.97; pairs_used=58,050,018; median(λ)=928km, median(R²)=0.97; CV(λ)=0.31; regions_fit=5
[13:04:23] [INFO]   pos_jitter/phase_alignment: global λ=1770km, R²=0.96; pairs_used=58,050,018; median(λ)=1770km, median(R²)=0.96; CV(λ)=0.55; regions_fit=5
[13:04:23] [INFO]   clock_drift/msc: global λ=764km, R²=0.93; pairs_used=58,050,018; median(λ)=764km, median(R²)=0.93; CV(λ)=0.57; regions_fit=5
[13:04:23] [INFO]   clock_drift/phase_alignment: global λ=984km, R²=0.97; pairs_used=58,050,018; median(λ)=1009km, median(R²)=0.97; CV(λ)=0.15; regions_fit=5
[13:04:23] [INFO]   bias–drift (msc/global): λ_bias=821km, λ_drift=764km, Δλ=58km, rel=0.07, R²_bias=0.93, R²_drift=0.93
[13:04:23] [INFO]   bias–drift (phase_alignment/global): λ_bias=1771km, λ_drift=984km, Δλ=787km, rel=0.57, R²_bias=0.96, R²_drift=0.97 [WARNING: bias–drift mismatch]
[13:04:23] [SUCCESS] Saved: step_2_1_control_tests_all_stations.json
[13:04:23] [INFO] 
################################################################################
[13:04:23] [INFO] # FILTER: OPTIMAL_100
[13:04:23] [INFO] ################################################################################
[13:04:23] [INFO]   Using 100 stations from optimal_100_metadata.json
[13:04:23] [INFO] 
============================================================
[13:04:23] [INFO] MODE: PRECISE (GPS SPP with Precise Orbits)
[13:04:23] [INFO] ============================================================
[13:04:23] [INFO] Processing clock_bias...
[13:04:23] [INFO]   Filtered to 100 stations
[13:04:26] [INFO]   Fitting clock_bias/msc...
[13:04:26] [INFO]     global      : λ=975km, R²=0.97
[13:04:26] [INFO]     europe      : λ=541km, R²=0.96
[13:04:26] [INFO]     non_europe  : λ=1004km, R²=0.91
[13:04:26] [INFO]     northern    : λ=659km, R²=0.97
[13:04:26] [INFO]     southern    : λ=752km, R²=0.88
[13:04:26] [INFO]   Fitting clock_bias/phase_alignment...
[13:04:26] [INFO]     global      : λ=1831km, R²=0.75
[13:04:26] [INFO]     europe      : λ=16774km, R²=0.97
[13:04:26] [INFO]     non_europe  : λ=1615km, R²=0.53
[13:04:26] [INFO]     northern    : λ=3315km, R²=0.83
[13:04:26] [INFO]     southern    : λ=1576km, R²=0.44
[13:04:26] [INFO] Processing pos_jitter...
[13:04:26] [INFO]   Filtered to 100 stations
[13:04:29] [INFO]   Fitting pos_jitter/msc...
[13:04:29] [INFO]     global      : λ=776km, R²=0.93
[13:04:29] [INFO]     europe      : λ=471km, R²=0.91
[13:04:29] [INFO]     non_europe  : λ=1399km, R²=0.95
[13:04:29] [INFO]     northern    : λ=540km, R²=0.93
[13:04:29] [INFO]     southern    : λ=1359km, R²=0.94
[13:04:29] [INFO]   Fitting pos_jitter/phase_alignment...
[13:04:29] [INFO]     global      : λ=5026km, R²=0.94
[13:04:29] [INFO]     europe      : λ=4176km, R²=0.95
[13:04:29] [INFO]     non_europe  : λ=3915km, R²=0.87
[13:04:29] [INFO]     northern    : λ=1166km, R²=0.91
[13:04:29] [INFO]     southern    : λ=2251km, R²=0.75
[13:04:29] [INFO] Processing clock_drift...
[13:04:29] [INFO]   Filtered to 100 stations
[13:04:32] [INFO]   Fitting clock_drift/msc...
[13:04:32] [INFO]     global      : λ=1001km, R²=0.97
[13:04:32] [INFO]     europe      : λ=553km, R²=0.96
[13:04:32] [INFO]     non_europe  : λ=977km, R²=0.91
[13:04:32] [INFO]     northern    : λ=672km, R²=0.97
[13:04:32] [INFO]     southern    : λ=756km, R²=0.88
[13:04:32] [INFO]   Fitting clock_drift/phase_alignment...
[13:04:32] [INFO]     global      : λ=1198km, R²=0.86
[13:04:32] [INFO]     europe      : λ=1023km, R²=0.97
[13:04:32] [INFO]     non_europe  : λ=1153km, R²=0.72
[13:04:32] [INFO]     northern    : λ=2296km, R²=0.97
[13:04:32] [INFO]     southern    : λ=1178km, R²=0.70
[13:04:32] [INFO] 
------------------------------------------------------------
[13:04:32] [INFO] SUMMARY: PRECISE (GPS SPP with Precise Orbits)
[13:04:32] [INFO] ------------------------------------------------------------
[13:04:32] [INFO]   clock_bias/msc: global λ=975km, R²=0.97; pairs_used=2,363,336; median(λ)=752km, median(R²)=0.96; CV(λ)=0.23; regions_fit=5
[13:04:32] [INFO]   clock_bias/phase_alignment: global λ=1831km, R²=0.75; pairs_used=2,363,336; median(λ)=1831km, median(R²)=0.75; CV(λ)=1.18; regions_fit=5 [FLAG: flat/very-long λ]
[13:04:32] [INFO]   pos_jitter/msc: global λ=776km, R²=0.93; pairs_used=2,363,336; median(λ)=776km, median(R²)=0.93; CV(λ)=0.44; regions_fit=5
[13:04:32] [INFO]   pos_jitter/phase_alignment: global λ=5026km, R²=0.94; pairs_used=2,363,336; median(λ)=3915km, median(R²)=0.91; CV(λ)=0.42; regions_fit=5
[13:04:32] [INFO]   clock_drift/msc: global λ=1001km, R²=0.97; pairs_used=2,363,336; median(λ)=756km, median(R²)=0.96; CV(λ)=0.22; regions_fit=5
[13:04:32] [INFO]   clock_drift/phase_alignment: global λ=1198km, R²=0.86; pairs_used=2,363,336; median(λ)=1178km, median(R²)=0.86; CV(λ)=0.34; regions_fit=5
[13:04:32] [INFO]   bias–drift (msc/global): λ_bias=975km, λ_drift=1001km, Δλ=-26km, rel=0.03, R²_bias=0.97, R²_drift=0.97
[13:04:32] [INFO]   bias–drift (phase_alignment/global): λ_bias=1831km, λ_drift=1198km, Δλ=633km, rel=0.42, R²_bias=0.75, R²_drift=0.86 [WARNING: bias–drift mismatch]
[13:04:32] [INFO] 
============================================================
[13:04:32] [INFO] MODE: BASELINE (GPS L1 only)
[13:04:32] [INFO] ============================================================
[13:04:32] [INFO] Processing clock_bias...
[13:04:32] [INFO]   Filtered to 100 stations
[13:04:34] [INFO]   Fitting clock_bias/msc...
[13:04:34] [INFO]     global      : λ=632km, R²=0.97
[13:04:34] [INFO]     europe      : λ=507km, R²=0.97
[13:04:34] [INFO]     non_europe  : λ=928km, R²=0.94
[13:04:34] [INFO]     northern    : λ=507km, R²=0.98
[13:04:34] [INFO]     southern    : λ=906km, R²=0.91
[13:04:34] [INFO]   Fitting clock_bias/phase_alignment...
[13:04:34] [INFO]     global      : λ=2053km, R²=0.94
[13:04:34] [INFO]     europe      : λ=6764km, R²=0.96
[13:04:34] [INFO]     non_europe  : λ=1855km, R²=0.85
[13:04:34] [INFO]     northern    : λ=5653km, R²=0.98
[13:04:34] [INFO]     southern    : λ=1878km, R²=0.82
[13:04:34] [INFO] Processing pos_jitter...
[13:04:34] [INFO]   Filtered to 100 stations
[13:04:37] [INFO]   Fitting pos_jitter/msc...
[13:04:37] [INFO]     global      : λ=683km, R²=0.99
[13:04:37] [INFO]     europe      : λ=564km, R²=0.99
[13:04:37] [INFO]     non_europe  : λ=1110km, R²=0.96
[13:04:37] [INFO]     northern    : λ=588km, R²=1.00
[13:04:37] [INFO]     southern    : λ=1146km, R²=0.95
[13:04:37] [INFO]   Fitting pos_jitter/phase_alignment...
[13:04:37] [INFO]     global      : λ=2988km, R²=0.99
[13:04:37] [INFO]     europe      : λ=7937km, R²=0.89
[13:04:37] [INFO]     non_europe  : λ=2213km, R²=0.97
[13:04:37] [INFO]     northern    : λ=5797km, R²=0.98
[13:04:37] [INFO]     southern    : λ=2143km, R²=0.97
[13:04:37] [INFO] Processing clock_drift...
[13:04:37] [INFO]   Filtered to 100 stations
[13:04:40] [INFO]   Fitting clock_drift/msc...
[13:04:40] [INFO]     global      : λ=625km, R²=0.98
[13:04:40] [INFO]     europe      : λ=509km, R²=0.97
[13:04:40] [INFO]     non_europe  : λ=903km, R²=0.94
[13:04:40] [INFO]     northern    : λ=511km, R²=0.98
[13:04:40] [INFO]     southern    : λ=887km, R²=0.91
[13:04:40] [INFO]   Fitting clock_drift/phase_alignment...
[13:04:40] [INFO]     global      : λ=1057km, R²=0.95
[13:04:40] [INFO]     europe      : λ=1394km, R²=0.97
[13:04:40] [INFO]     non_europe  : λ=869km, R²=0.90
[13:04:40] [INFO]     northern    : λ=1571km, R²=0.99
[13:04:40] [INFO]     southern    : λ=775km, R²=0.86
[13:04:40] [INFO] 
------------------------------------------------------------
[13:04:40] [INFO] SUMMARY: BASELINE (GPS L1 only)
[13:04:40] [INFO] ------------------------------------------------------------
[13:04:40] [INFO]   clock_bias/msc: global λ=632km, R²=0.97; pairs_used=2,422,247; median(λ)=632km, median(R²)=0.97; CV(λ)=0.27; regions_fit=5
[13:04:40] [INFO]   clock_bias/phase_alignment: global λ=2053km, R²=0.94; pairs_used=2,422,247; median(λ)=2053km, median(R²)=0.94; CV(λ)=0.58; regions_fit=5
[13:04:40] [INFO]   pos_jitter/msc: global λ=683km, R²=0.99; pairs_used=2,422,247; median(λ)=683km, median(R²)=0.99; CV(λ)=0.31; regions_fit=5
[13:04:40] [INFO]   pos_jitter/phase_alignment: global λ=2988km, R²=0.99; pairs_used=2,422,247; median(λ)=2988km, median(R²)=0.97; CV(λ)=0.54; regions_fit=5
[13:04:40] [INFO]   clock_drift/msc: global λ=625km, R²=0.98; pairs_used=2,422,247; median(λ)=625km, median(R²)=0.97; CV(λ)=0.25; regions_fit=5
[13:04:40] [INFO]   clock_drift/phase_alignment: global λ=1057km, R²=0.95; pairs_used=2,422,247; median(λ)=1057km, median(R²)=0.95; CV(λ)=0.27; regions_fit=5
[13:04:40] [INFO]   bias–drift (msc/global): λ_bias=632km, λ_drift=625km, Δλ=7km, rel=0.01, R²_bias=0.97, R²_drift=0.98
[13:04:40] [INFO]   bias–drift (phase_alignment/global): λ_bias=2053km, λ_drift=1057km, Δλ=996km, rel=0.64, R²_bias=0.94, R²_drift=0.95 [WARNING: bias–drift mismatch]
[13:04:40] [INFO] 
============================================================
[13:04:40] [INFO] MODE: IONOFREE (Dual-frequency L1+L2 ionosphere-free)
[13:04:40] [INFO] ============================================================
[13:04:40] [INFO] Processing clock_bias...
[13:04:40] [INFO]   Filtered to 100 stations
[13:04:43] [INFO]   Fitting clock_bias/msc...
[13:04:43] [INFO]     global      : λ=813km, R²=0.97
[13:04:43] [INFO]     europe      : λ=582km, R²=0.97
[13:04:43] [INFO]     non_europe  : λ=882km, R²=0.91
[13:04:43] [INFO]     northern    : λ=593km, R²=0.97
[13:04:43] [INFO]     southern    : λ=716km, R²=0.90
[13:04:43] [INFO]   Fitting clock_bias/phase_alignment...
[13:04:43] [INFO]     global      : λ=1923km, R²=0.84
[13:04:43] [INFO]     europe      : λ=10405km, R²=0.96
[13:04:43] [INFO]     non_europe  : λ=1523km, R²=0.67
[13:04:43] [INFO]     northern    : λ=3421km, R²=0.90
[13:04:43] [INFO]     southern    : λ=1552km, R²=0.59
[13:04:43] [INFO] Processing pos_jitter...
[13:04:43] [INFO]   Filtered to 100 stations
[13:04:45] [INFO]   Fitting pos_jitter/msc...
[13:04:45] [INFO]     global      : λ=683km, R²=0.95
[13:04:45] [INFO]     europe      : λ=540km, R²=0.95
[13:04:45] [INFO]     non_europe  : λ=1628km, R²=0.94
[13:04:45] [INFO]     northern    : λ=509km, R²=0.96
[13:04:45] [INFO]     southern    : λ=1519km, R²=0.93
[13:04:45] [INFO]   Fitting pos_jitter/phase_alignment...
[13:04:45] [INFO]     global      : λ=3866km, R²=0.96
[13:04:45] [INFO]     europe      : λ=3889km, R²=0.95
[13:04:45] [INFO]     non_europe  : λ=2608km, R²=0.89
[13:04:45] [INFO]     northern    : λ=1143km, R²=0.92
[13:04:45] [INFO]     southern    : λ=2171km, R²=0.81
[13:04:45] [INFO] Processing clock_drift...
[13:04:45] [INFO]   Filtered to 100 stations
[13:04:48] [INFO]   Fitting clock_drift/msc...
[13:04:48] [INFO]     global      : λ=823km, R²=0.97
[13:04:48] [INFO]     europe      : λ=607km, R²=0.97
[13:04:48] [INFO]     non_europe  : λ=874km, R²=0.91
[13:04:48] [INFO]     northern    : λ=597km, R²=0.98
[13:04:48] [INFO]     southern    : λ=717km, R²=0.90
[13:04:48] [INFO]   Fitting clock_drift/phase_alignment...
[13:04:48] [INFO]     global      : λ=1072km, R²=0.92
[13:04:48] [INFO]     europe      : λ=1148km, R²=0.98
[13:04:48] [INFO]     non_europe  : λ=1000km, R²=0.82
[13:04:48] [INFO]     northern    : λ=1791km, R²=0.99
[13:04:48] [INFO]     southern    : λ=1028km, R²=0.79
[13:04:48] [INFO] 
------------------------------------------------------------
[13:04:48] [INFO] SUMMARY: IONOFREE (Dual-frequency L1+L2 ionosphere-free)
[13:04:48] [INFO] ------------------------------------------------------------
[13:04:48] [INFO]   clock_bias/msc: global λ=813km, R²=0.97; pairs_used=2,371,876; median(λ)=716km, median(R²)=0.97; CV(λ)=0.16; regions_fit=5
[13:04:48] [INFO]   clock_bias/phase_alignment: global λ=1923km, R²=0.84; pairs_used=2,371,876; median(λ)=1923km, median(R²)=0.84; CV(λ)=0.90; regions_fit=5
[13:04:48] [INFO]   pos_jitter/msc: global λ=683km, R²=0.95; pairs_used=2,371,876; median(λ)=683km, median(R²)=0.95; CV(λ)=0.50; regions_fit=5
[13:04:48] [INFO]   pos_jitter/phase_alignment: global λ=3866km, R²=0.96; pairs_used=2,371,876; median(λ)=2608km, median(R²)=0.92; CV(λ)=0.38; regions_fit=5
[13:04:48] [INFO]   clock_drift/msc: global λ=823km, R²=0.97; pairs_used=2,371,876; median(λ)=717km, median(R²)=0.97; CV(λ)=0.15; regions_fit=5
[13:04:48] [INFO]   clock_drift/phase_alignment: global λ=1072km, R²=0.92; pairs_used=2,371,876; median(λ)=1072km, median(R²)=0.92; CV(λ)=0.25; regions_fit=5
[13:04:48] [INFO]   bias–drift (msc/global): λ_bias=813km, λ_drift=823km, Δλ=-10km, rel=0.01, R²_bias=0.97, R²_drift=0.97
[13:04:48] [INFO]   bias–drift (phase_alignment/global): λ_bias=1923km, λ_drift=1072km, Δλ=851km, rel=0.57, R²_bias=0.84, R²_drift=0.92 [WARNING: bias–drift mismatch]
[13:04:48] [INFO] 
============================================================
[13:04:48] [INFO] MODE: MULTI_GNSS (GPS+GLO+GAL+BDS)
[13:04:48] [INFO] ============================================================
[13:04:48] [INFO] Processing clock_bias...
[13:04:48] [INFO]   Filtered to 100 stations
[13:04:51] [INFO]   Fitting clock_bias/msc...
[13:04:51] [INFO]     global      : λ=707km, R²=0.95
[13:04:51] [INFO]     europe      : λ=437km, R²=0.92
[13:04:51] [INFO]     non_europe  : λ=1233km, R²=0.92
[13:04:51] [INFO]     northern    : λ=537km, R²=0.94
[13:04:51] [INFO]     southern    : λ=1297km, R²=0.88
[13:04:51] [INFO]   Fitting clock_bias/phase_alignment...
[13:04:51] [INFO]     global      : λ=2191km, R²=0.97
[13:04:51] [INFO]     europe      : λ=2016km, R²=0.90
[13:04:51] [INFO]     non_europe  : λ=1969km, R²=0.89
[13:04:51] [INFO]     northern    : λ=5036km, R²=0.98
[13:04:51] [INFO]     southern    : λ=2006km, R²=0.84
[13:04:51] [INFO] Processing pos_jitter...
[13:04:51] [INFO]   Filtered to 100 stations
[13:04:54] [INFO]   Fitting pos_jitter/msc...
[13:04:54] [INFO]     global      : λ=796km, R²=0.97
[13:04:54] [INFO]     europe      : λ=501km, R²=0.97
[13:04:54] [INFO]     non_europe  : λ=1365km, R²=0.95
[13:04:54] [INFO]     northern    : λ=669km, R²=0.97
[13:04:54] [INFO]     southern    : λ=1473km, R²=0.94
[13:04:54] [INFO]   Fitting pos_jitter/phase_alignment...
[13:04:54] [INFO]     global      : λ=2726km, R²=0.98
[13:04:54] [INFO]     europe      : λ=8003km, R²=0.90
[13:04:54] [INFO]     non_europe  : λ=2150km, R²=0.98
[13:04:54] [INFO]     northern    : λ=5356km, R²=0.98
[13:04:54] [INFO]     southern    : λ=2103km, R²=0.98
[13:04:54] [INFO] Processing clock_drift...
[13:04:54] [INFO]   Filtered to 100 stations
[13:04:56] [INFO]   Fitting clock_drift/msc...
[13:04:56] [INFO]     global      : λ=683km, R²=0.95
[13:04:56] [INFO]     europe      : λ=433km, R²=0.92
[13:04:56] [INFO]     non_europe  : λ=1210km, R²=0.92
[13:04:56] [INFO]     northern    : λ=537km, R²=0.94
[13:04:56] [INFO]     southern    : λ=1285km, R²=0.88
[13:04:56] [INFO]   Fitting clock_drift/phase_alignment...
[13:04:56] [INFO]     global      : λ=1178km, R²=0.97
[13:04:56] [INFO]     europe      : λ=1366km, R²=0.97
[13:04:56] [INFO]     non_europe  : λ=989km, R²=0.92
[13:04:56] [INFO]     northern    : λ=1656km, R²=0.99
[13:04:56] [INFO]     southern    : λ=884km, R²=0.88
[13:04:56] [INFO] 
------------------------------------------------------------
[13:04:56] [INFO] SUMMARY: MULTI_GNSS (GPS+GLO+GAL+BDS)
[13:04:56] [INFO] ------------------------------------------------------------
[13:04:56] [INFO]   clock_bias/msc: global λ=707km, R²=0.95; pairs_used=2,341,326; median(λ)=707km, median(R²)=0.92; CV(λ)=0.42; regions_fit=5
[13:04:56] [INFO]   clock_bias/phase_alignment: global λ=2191km, R²=0.97; pairs_used=2,341,326; median(λ)=2016km, median(R²)=0.90; CV(λ)=0.45; regions_fit=5
[13:04:56] [INFO]   pos_jitter/msc: global λ=796km, R²=0.97; pairs_used=2,341,326; median(λ)=796km, median(R²)=0.97; CV(λ)=0.40; regions_fit=5
[13:04:56] [INFO]   pos_jitter/phase_alignment: global λ=2726km, R²=0.98; pairs_used=2,341,326; median(λ)=2726km, median(R²)=0.98; CV(λ)=0.57; regions_fit=5
[13:04:56] [INFO]   clock_drift/msc: global λ=683km, R²=0.95; pairs_used=2,341,326; median(λ)=683km, median(R²)=0.92; CV(λ)=0.42; regions_fit=5
[13:04:56] [INFO]   clock_drift/phase_alignment: global λ=1178km, R²=0.97; pairs_used=2,341,326; median(λ)=1178km, median(R²)=0.97; CV(λ)=0.23; regions_fit=5
[13:04:56] [INFO]   bias–drift (msc/global): λ_bias=707km, λ_drift=683km, Δλ=24km, rel=0.03, R²_bias=0.95, R²_drift=0.95
[13:04:56] [INFO]   bias–drift (phase_alignment/global): λ_bias=2191km, λ_drift=1178km, Δλ=1013km, rel=0.60, R²_bias=0.97, R²_drift=0.97 [WARNING: bias–drift mismatch]
[13:04:56] [SUCCESS] Saved: step_2_1_control_tests_optimal_100.json
[13:04:56] [INFO] 
################################################################################
[13:04:56] [INFO] # FILTER: DYNAMIC_50
[13:04:56] [INFO] ################################################################################
[13:04:56] [INFO]   Using 400 stations from dynamic_50_metadata.json
[13:04:56] [INFO] 
============================================================
[13:04:56] [INFO] MODE: PRECISE (GPS SPP with Precise Orbits)
[13:04:56] [INFO] ============================================================
[13:04:56] [INFO] Processing clock_bias...
[13:04:56] [INFO]   Filtered to 400 stations
[13:05:38] [INFO]   Fitting clock_bias/msc...
[13:05:38] [INFO]     global      : λ=1214km, R²=0.98
[13:05:38] [INFO]     europe      : λ=813km, R²=0.99
[13:05:38] [INFO]     non_europe  : λ=1578km, R²=0.97
[13:05:38] [INFO]     northern    : λ=1151km, R²=0.98
[13:05:38] [INFO]     southern    : λ=1225km, R²=0.97
[13:05:38] [INFO]   Fitting clock_bias/phase_alignment...
[13:05:38] [INFO]     global      : λ=1766km, R²=0.71
[13:05:38] [INFO]     europe      : λ=8172km, R²=0.86
[13:05:38] [INFO]     non_europe  : λ=1839km, R²=0.74
[13:05:38] [INFO]     northern    : λ=1769km, R²=0.66
[13:05:38] [INFO]     southern    : λ=2016km, R²=0.77
[13:05:38] [INFO] Processing pos_jitter...
[13:05:38] [INFO]   Filtered to 400 stations
[13:06:19] [INFO]   Fitting pos_jitter/msc...
[13:06:19] [INFO]     global      : λ=1336km, R²=0.93
[13:06:19] [INFO]     europe      : λ=632km, R²=0.98
[13:06:19] [INFO]     non_europe  : λ=2167km, R²=0.96
[13:06:19] [INFO]     northern    : λ=1213km, R²=0.92
[13:06:19] [INFO]     southern    : λ=1129km, R²=0.93
[13:06:19] [INFO]   Fitting pos_jitter/phase_alignment...
[13:06:19] [INFO]     global      : λ=3447km, R²=0.96
[13:06:19] [INFO]     europe      : λ=3568km, R²=0.97
[13:06:19] [INFO]     non_europe  : λ=3523km, R²=0.96
[13:06:19] [INFO]     northern    : λ=2338km, R²=0.95
[13:06:19] [INFO]     southern    : λ=1605km, R²=0.91
[13:06:19] [INFO] Processing clock_drift...
[13:06:19] [INFO]   Filtered to 400 stations
[13:07:00] [INFO]   Fitting clock_drift/msc...
[13:07:00] [INFO]     global      : λ=1219km, R²=0.98
[13:07:00] [INFO]     europe      : λ=830km, R²=0.99
[13:07:00] [INFO]     non_europe  : λ=1604km, R²=0.97
[13:07:00] [INFO]     northern    : λ=1160km, R²=0.98
[13:07:00] [INFO]     southern    : λ=1195km, R²=0.97
[13:07:00] [INFO]   Fitting clock_drift/phase_alignment...
[13:07:00] [INFO]     global      : λ=1190km, R²=0.86
[13:07:00] [INFO]     europe      : λ=1210km, R²=0.98
[13:07:00] [INFO]     non_europe  : λ=1275km, R²=0.90
[13:07:00] [INFO]     northern    : λ=1223km, R²=0.86
[13:07:00] [INFO]     southern    : λ=1237km, R²=0.82
[13:07:01] [INFO] 
------------------------------------------------------------
[13:07:01] [INFO] SUMMARY: PRECISE (GPS SPP with Precise Orbits)
[13:07:01] [INFO] ------------------------------------------------------------
[13:07:01] [INFO]   clock_bias/msc: global λ=1214km, R²=0.98; pairs_used=35,127,923; median(λ)=1214km, median(R²)=0.98; CV(λ)=0.20; regions_fit=5
[13:07:01] [INFO]   clock_bias/phase_alignment: global λ=1766km, R²=0.71; pairs_used=35,127,923; median(λ)=1839km, median(R²)=0.74; CV(λ)=0.81; regions_fit=5
[13:07:01] [INFO]   pos_jitter/msc: global λ=1336km, R²=0.93; pairs_used=35,127,923; median(λ)=1213km, median(R²)=0.93; CV(λ)=0.38; regions_fit=5
[13:07:01] [INFO]   pos_jitter/phase_alignment: global λ=3447km, R²=0.96; pairs_used=35,127,923; median(λ)=3447km, median(R²)=0.96; CV(λ)=0.27; regions_fit=5
[13:07:01] [INFO]   clock_drift/msc: global λ=1219km, R²=0.98; pairs_used=35,127,923; median(λ)=1195km, median(R²)=0.98; CV(λ)=0.20; regions_fit=5
[13:07:01] [INFO]   clock_drift/phase_alignment: global λ=1190km, R²=0.86; pairs_used=35,127,923; median(λ)=1223km, median(R²)=0.86; CV(λ)=0.02; regions_fit=5
[13:07:01] [INFO]   bias–drift (msc/global): λ_bias=1214km, λ_drift=1219km, Δλ=-6km, rel=0.00, R²_bias=0.98, R²_drift=0.98
[13:07:01] [INFO]   bias–drift (phase_alignment/global): λ_bias=1766km, λ_drift=1190km, Δλ=575km, rel=0.39, R²_bias=0.71, R²_drift=0.86 [WARNING: bias–drift mismatch]
[13:07:01] [INFO] 
============================================================
[13:07:01] [INFO] MODE: BASELINE (GPS L1 only)
[13:07:01] [INFO] ============================================================
[13:07:01] [INFO] Processing clock_bias...
[13:07:01] [INFO]   Filtered to 400 stations
[13:07:42] [INFO]   Fitting clock_bias/msc...
[13:07:42] [INFO]     global      : λ=766km, R²=0.97
[13:07:42] [INFO]     europe      : λ=505km, R²=0.99
[13:07:42] [INFO]     non_europe  : λ=879km, R²=0.97
[13:07:42] [INFO]     northern    : λ=744km, R²=0.98
[13:07:42] [INFO]     southern    : λ=1036km, R²=0.94
[13:07:42] [INFO]   Fitting clock_bias/phase_alignment...
[13:07:42] [INFO]     global      : λ=1789km, R²=0.90
[13:07:42] [INFO]     europe      : λ=2876km, R²=0.99
[13:07:42] [INFO]     non_europe  : λ=1702km, R²=0.88
[13:07:42] [INFO]     northern    : λ=1985km, R²=0.90
[13:07:42] [INFO]     southern    : λ=1535km, R²=0.86
[13:07:42] [INFO] Processing pos_jitter...
[13:07:42] [INFO]   Filtered to 400 stations
[13:08:23] [INFO]   Fitting pos_jitter/msc...
[13:08:23] [INFO]     global      : λ=898km, R²=0.98
[13:08:23] [INFO]     europe      : λ=563km, R²=1.00
[13:08:23] [INFO]     non_europe  : λ=1021km, R²=0.98
[13:08:23] [INFO]     northern    : λ=875km, R²=0.98
[13:08:23] [INFO]     southern    : λ=1069km, R²=0.95
[13:08:23] [INFO]   Fitting pos_jitter/phase_alignment...
[13:08:23] [INFO]     global      : λ=2070km, R²=0.97
[13:08:23] [INFO]     europe      : λ=5403km, R²=0.95
[13:08:23] [INFO]     non_europe  : λ=2002km, R²=0.96
[13:08:23] [INFO]     northern    : λ=2137km, R²=0.96
[13:08:23] [INFO]     southern    : λ=1734km, R²=0.97
[13:08:24] [INFO] Processing clock_drift...
[13:08:24] [INFO]   Filtered to 400 stations
[13:09:05] [INFO]   Fitting clock_drift/msc...
[13:09:05] [INFO]     global      : λ=747km, R²=0.97
[13:09:05] [INFO]     europe      : λ=503km, R²=0.99
[13:09:05] [INFO]     non_europe  : λ=867km, R²=0.97
[13:09:05] [INFO]     northern    : λ=728km, R²=0.98
[13:09:05] [INFO]     southern    : λ=1015km, R²=0.93
[13:09:05] [INFO]   Fitting clock_drift/phase_alignment...
[13:09:05] [INFO]     global      : λ=1032km, R²=0.94
[13:09:05] [INFO]     europe      : λ=985km, R²=0.98
[13:09:05] [INFO]     non_europe  : λ=1092km, R²=0.96
[13:09:05] [INFO]     northern    : λ=1068km, R²=0.94
[13:09:05] [INFO]     southern    : λ=870km, R²=0.93
[13:09:05] [INFO] 
------------------------------------------------------------
[13:09:05] [INFO] SUMMARY: BASELINE (GPS L1 only)
[13:09:05] [INFO] ------------------------------------------------------------
[13:09:05] [INFO]   clock_bias/msc: global λ=766km, R²=0.97; pairs_used=36,654,612; median(λ)=766km, median(R²)=0.97; CV(λ)=0.22; regions_fit=5
[13:09:05] [INFO]   clock_bias/phase_alignment: global λ=1789km, R²=0.90; pairs_used=36,654,612; median(λ)=1789km, median(R²)=0.90; CV(λ)=0.24; regions_fit=5
[13:09:05] [INFO]   pos_jitter/msc: global λ=898km, R²=0.98; pairs_used=36,654,612; median(λ)=898km, median(R²)=0.98; CV(λ)=0.20; regions_fit=5
[13:09:05] [INFO]   pos_jitter/phase_alignment: global λ=2070km, R²=0.97; pairs_used=36,654,612; median(λ)=2070km, median(R²)=0.96; CV(λ)=0.51; regions_fit=5
[13:09:05] [INFO]   clock_drift/msc: global λ=747km, R²=0.97; pairs_used=36,654,612; median(λ)=747km, median(R²)=0.97; CV(λ)=0.22; regions_fit=5
[13:09:05] [INFO]   clock_drift/phase_alignment: global λ=1032km, R²=0.94; pairs_used=36,654,612; median(λ)=1032km, median(R²)=0.94; CV(λ)=0.08; regions_fit=5
[13:09:05] [INFO]   bias–drift (msc/global): λ_bias=766km, λ_drift=747km, Δλ=18km, rel=0.02, R²_bias=0.97, R²_drift=0.97
[13:09:05] [INFO]   bias–drift (phase_alignment/global): λ_bias=1789km, λ_drift=1032km, Δλ=757km, rel=0.54, R²_bias=0.90, R²_drift=0.94 [WARNING: bias–drift mismatch]
[13:09:05] [INFO] 
============================================================
[13:09:05] [INFO] MODE: IONOFREE (Dual-frequency L1+L2 ionosphere-free)
[13:09:05] [INFO] ============================================================
[13:09:05] [INFO] Processing clock_bias...
[13:09:05] [INFO]   Filtered to 400 stations
[13:09:47] [INFO]   Fitting clock_bias/msc...
[13:09:47] [INFO]     global      : λ=1084km, R²=0.98
[13:09:47] [INFO]     europe      : λ=723km, R²=0.99
[13:09:47] [INFO]     non_europe  : λ=1324km, R²=0.98
[13:09:47] [INFO]     northern    : λ=1033km, R²=0.98
[13:09:47] [INFO]     southern    : λ=1120km, R²=0.97
[13:09:47] [INFO]   Fitting clock_bias/phase_alignment...
[13:09:47] [INFO]     global      : λ=1849km, R²=0.79
[13:09:47] [INFO]     europe      : λ=6620km, R²=0.91
[13:09:47] [INFO]     non_europe  : λ=1931km, R²=0.82
[13:09:47] [INFO]     northern    : λ=1840km, R²=0.74
[13:09:47] [INFO]     southern    : λ=2125km, R²=0.84
[13:09:47] [INFO] Processing pos_jitter...
[13:09:47] [INFO]   Filtered to 400 stations
[13:10:29] [INFO]   Fitting pos_jitter/msc...
[13:10:29] [INFO]     global      : λ=1170km, R²=0.95
[13:10:29] [INFO]     europe      : λ=578km, R²=0.98
[13:10:29] [INFO]     non_europe  : λ=1791km, R²=0.96
[13:10:29] [INFO]     northern    : λ=1086km, R²=0.95
[13:10:29] [INFO]     southern    : λ=1333km, R²=0.94
[13:10:29] [INFO]   Fitting pos_jitter/phase_alignment...
[13:10:29] [INFO]     global      : λ=3341km, R²=0.95
[13:10:29] [INFO]     europe      : λ=3562km, R²=0.97
[13:10:29] [INFO]     non_europe  : λ=3307km, R²=0.95
[13:10:29] [INFO]     northern    : λ=2678km, R²=0.93
[13:10:29] [INFO]     southern    : λ=1992km, R²=0.93
[13:10:30] [INFO] Processing clock_drift...
[13:10:30] [INFO]   Filtered to 400 stations
[13:11:12] [INFO]   Fitting clock_drift/msc...
[13:11:12] [INFO]     global      : λ=1088km, R²=0.98
[13:11:12] [INFO]     europe      : λ=723km, R²=0.99
[13:11:12] [INFO]     non_europe  : λ=1336km, R²=0.97
[13:11:12] [INFO]     northern    : λ=1041km, R²=0.98
[13:11:12] [INFO]     southern    : λ=1070km, R²=0.97
[13:11:12] [INFO]   Fitting clock_drift/phase_alignment...
[13:11:12] [INFO]     global      : λ=1129km, R²=0.90
[13:11:12] [INFO]     europe      : λ=1022km, R²=0.98
[13:11:12] [INFO]     non_europe  : λ=1233km, R²=0.94
[13:11:12] [INFO]     northern    : λ=1147km, R²=0.89
[13:11:12] [INFO]     southern    : λ=1147km, R²=0.88
[13:11:12] [INFO] 
------------------------------------------------------------
[13:11:12] [INFO] SUMMARY: IONOFREE (Dual-frequency L1+L2 ionosphere-free)
[13:11:12] [INFO] ------------------------------------------------------------
[13:11:12] [INFO]   clock_bias/msc: global λ=1084km, R²=0.98; pairs_used=35,500,722; median(λ)=1084km, median(R²)=0.98; CV(λ)=0.18; regions_fit=5
[13:11:12] [INFO]   clock_bias/phase_alignment: global λ=1849km, R²=0.79; pairs_used=35,500,722; median(λ)=1931km, median(R²)=0.82; CV(λ)=0.65; regions_fit=5
[13:11:12] [INFO]   pos_jitter/msc: global λ=1170km, R²=0.95; pairs_used=35,500,722; median(λ)=1170km, median(R²)=0.95; CV(λ)=0.33; regions_fit=5
[13:11:12] [INFO]   pos_jitter/phase_alignment: global λ=3341km, R²=0.95; pairs_used=35,500,722; median(λ)=3307km, median(R²)=0.95; CV(λ)=0.19; regions_fit=5
[13:11:12] [INFO]   clock_drift/msc: global λ=1088km, R²=0.98; pairs_used=35,500,722; median(λ)=1070km, median(R²)=0.98; CV(λ)=0.19; regions_fit=5
[13:11:12] [INFO]   clock_drift/phase_alignment: global λ=1129km, R²=0.90; pairs_used=35,500,722; median(λ)=1147km, median(R²)=0.90; CV(λ)=0.06; regions_fit=5
[13:11:12] [INFO]   bias–drift (msc/global): λ_bias=1084km, λ_drift=1088km, Δλ=-4km, rel=0.00, R²_bias=0.98, R²_drift=0.98
[13:11:12] [INFO]   bias–drift (phase_alignment/global): λ_bias=1849km, λ_drift=1129km, Δλ=720km, rel=0.48, R²_bias=0.79, R²_drift=0.90 [WARNING: bias–drift mismatch]
[13:11:12] [INFO] 
============================================================
[13:11:12] [INFO] MODE: MULTI_GNSS (GPS+GLO+GAL+BDS)
[13:11:12] [INFO] ============================================================
[13:11:12] [INFO] Processing clock_bias...
[13:11:12] [INFO]   Filtered to 400 stations
[13:11:52] [INFO]   Fitting clock_bias/msc...
[13:11:52] [INFO]     global      : λ=834km, R²=0.95
[13:11:52] [INFO]     europe      : λ=531km, R²=0.97
[13:11:52] [INFO]     non_europe  : λ=879km, R²=0.95
[13:11:52] [INFO]     northern    : λ=800km, R²=0.96
[13:11:52] [INFO]     southern    : λ=1690km, R²=0.92
[13:11:52] [INFO]   Fitting clock_bias/phase_alignment...
[13:11:52] [INFO]     global      : λ=1749km, R²=0.97
[13:11:52] [INFO]     europe      : λ=1919km, R²=0.97
[13:11:52] [INFO]     non_europe  : λ=1527km, R²=0.95
[13:11:52] [INFO]     northern    : λ=1925km, R²=0.96
[13:11:52] [INFO]     southern    : λ=1655km, R²=0.96
[13:11:52] [INFO] Processing pos_jitter...
[13:11:52] [INFO]   Filtered to 400 stations
[13:12:33] [INFO]   Fitting pos_jitter/msc...
[13:12:33] [INFO]     global      : λ=907km, R²=0.98
[13:12:33] [INFO]     europe      : λ=568km, R²=0.99
[13:12:33] [INFO]     non_europe  : λ=931km, R²=0.97
[13:12:33] [INFO]     northern    : λ=863km, R²=0.98
[13:12:33] [INFO]     southern    : λ=1454km, R²=0.94
[13:12:33] [INFO]   Fitting pos_jitter/phase_alignment...
[13:12:33] [INFO]     global      : λ=1810km, R²=0.96
[13:12:33] [INFO]     europe      : λ=5188km, R²=0.96
[13:12:33] [INFO]     non_europe  : λ=1736km, R²=0.95
[13:12:33] [INFO]     northern    : λ=1889km, R²=0.96
[13:12:33] [INFO]     southern    : λ=1730km, R²=0.96
[13:12:33] [INFO] Processing clock_drift...
[13:12:33] [INFO]   Filtered to 400 stations
[13:13:13] [INFO]   Fitting clock_drift/msc...
[13:13:13] [INFO]     global      : λ=796km, R²=0.95
[13:13:13] [INFO]     europe      : λ=526km, R²=0.97
[13:13:13] [INFO]     non_europe  : λ=860km, R²=0.95
[13:13:13] [INFO]     northern    : λ=766km, R²=0.96
[13:13:13] [INFO]     southern    : λ=1687km, R²=0.91
[13:13:13] [INFO]   Fitting clock_drift/phase_alignment...
[13:13:13] [INFO]     global      : λ=994km, R²=0.97
[13:13:13] [INFO]     europe      : λ=1017km, R²=0.98
[13:13:13] [INFO]     non_europe  : λ=926km, R²=0.96
[13:13:13] [INFO]     northern    : λ=1024km, R²=0.97
[13:13:13] [INFO]     southern    : λ=963km, R²=0.95
[13:13:14] [INFO] 
------------------------------------------------------------
[13:13:14] [INFO] SUMMARY: MULTI_GNSS (GPS+GLO+GAL+BDS)
[13:13:14] [INFO] ------------------------------------------------------------
[13:13:14] [INFO]   clock_bias/msc: global λ=834km, R²=0.95; pairs_used=34,680,321; median(λ)=834km, median(R²)=0.95; CV(λ)=0.41; regions_fit=5
[13:13:14] [INFO]   clock_bias/phase_alignment: global λ=1749km, R²=0.97; pairs_used=34,680,321; median(λ)=1749km, median(R²)=0.96; CV(λ)=0.09; regions_fit=5
[13:13:14] [INFO]   pos_jitter/msc: global λ=907km, R²=0.98; pairs_used=34,680,321; median(λ)=907km, median(R²)=0.98; CV(λ)=0.30; regions_fit=5
[13:13:14] [INFO]   pos_jitter/phase_alignment: global λ=1810km, R²=0.96; pairs_used=34,680,321; median(λ)=1810km, median(R²)=0.96; CV(λ)=0.55; regions_fit=5
[13:13:14] [INFO]   clock_drift/msc: global λ=796km, R²=0.95; pairs_used=34,548,138; median(λ)=796km, median(R²)=0.95; CV(λ)=0.43; regions_fit=5
[13:13:14] [INFO]   clock_drift/phase_alignment: global λ=994km, R²=0.97; pairs_used=34,548,138; median(λ)=994km, median(R²)=0.97; CV(λ)=0.04; regions_fit=5
[13:13:14] [INFO]   bias–drift (msc/global): λ_bias=834km, λ_drift=796km, Δλ=38km, rel=0.05, R²_bias=0.95, R²_drift=0.95
[13:13:14] [INFO]   bias–drift (phase_alignment/global): λ_bias=1749km, λ_drift=994km, Δλ=755km, rel=0.55, R²_bias=0.97, R²_drift=0.97 [WARNING: bias–drift mismatch]
[13:13:14] [SUCCESS] Saved: step_2_1_control_tests_dynamic_50.json
[13:13:14] [SUCCESS] Saved figure to /Users/matthewsmawfield/www/TEP-GNSS-RINEX/results/figures/step_2_1_control_tests.png
[13:13:14] [SUCCESS] COMPLETE: 3 filters × 4 modes
